{
  "schema_version": "2.0.0",
  "election_year": 2009,
  "election_type": "midterm",
  "election_label": "Elección 2009 · Intermedia",
  "status": "validated_candidate_data",
  "created_at_utc": "2026-10-24T05:26:05.480210+00:00",
  "method": "rule_based_segmentation_and_continuous_indicators",
  "resources": {
    "profiles": "profiles.json",
    "national_references": "national_references.json",
    "national_statistics": "national_statistics.json",
    "age_statistics": "age_statistics.json",
    "sex_statistics": "sex_statistics.json",
    "section_statistics": "section_statistics.json",
    "municipalities": "municipalities.json",
    "states": "states.json",
    "state_profiles": "state_profiles.json",
    "continuous_indicators": "continuous_indicators.json",
    "sex_gaps": "sex_gaps.json",
    "quality_summary": "quality_summary.json",
    "assignment_status": "assignment_status.json",
    "municipality_segments": "municipality_segments/{state_code}.json",
    "municipality_profiles": "municipality_profiles/{state_code}.json",
    "exact_age_segments": "exact_age_segments/{state_code}.json",
    "metadata": "metadata.json"
  },
  "schemas": {
    "profiles": "../../schemas/profiles.schema.json",
    "national_references": "../../schemas/national_references.schema.json",
    "national_statistics": "../../schemas/national_statistics.schema.json",
    "age_statistics": "../../schemas/age_statistics.schema.json",
    "sex_statistics": "../../schemas/sex_statistics.schema.json",
    "section_statistics": "../../schemas/section_statistics.schema.json",
    "municipalities": "../../schemas/municipalities.schema.json",
    "states": "../../schemas/states.schema.json",
    "state_profiles": "../../schemas/state_profiles.schema.json",
    "municipality_profiles": "../../schemas/municipality_profiles.schema.json",
    "municipality_segments": "../../schemas/municipality_segments.schema.json",
    "continuous_indicators": "../../schemas/continuous_indicators.schema.json",
    "sex_gaps": "../../schemas/sex_gaps.schema.json",
    "quality_summary": "../../schemas/quality_summary.schema.json",
    "assignment_status": "../../schemas/assignment_status.schema.json",
    "exact_age_segments": "../../schemas/exact_age_segments.schema.json"
  },
  "state_codes": [
    "1",
    "10",
    "11",
    "12",
    "13",
    "14",
    "15",
    "16",
    "17",
    "18",
    "19",
    "2",
    "20",
    "21",
    "22",
    "23",
    "24",
    "25",
    "26",
    "27",
    "28",
    "29",
    "3",
    "30",
    "31",
    "32",
    "4",
    "5",
    "6",
    "7",
    "8",
    "9"
  ],
  "units": {
    "profiles": "rule_candidate",
    "national_references": "national_age_band_sex",
    "national_statistics": "election",
    "age_statistics": "national_exact_age_sex",
    "sex_statistics": "national_sex",
    "section_statistics": "national_section_type",
    "municipalities": "municipality",
    "states": "state",
    "state_profiles": "state_rule_candidate",
    "municipality_profiles": "municipality_rule_candidate",
    "municipality_segments": "municipality_age_band_sex",
    "continuous_indicators": "municipality_sex",
    "sex_gaps": "municipality_age_band",
    "quality_summary": "election_quality",
    "assignment_status": "segment_assignment_status",
    "exact_age_segments": "municipality_exact_age_sex"
  },
  "definitions": {
    "observed_participation": "SV/(SV+NV), NULL si SV+NV=0",
    "nominal_participation": "SV/LN",
    "unspecified_rate": "NS/LN; no abstención",
    "national_reference": "ΣSV/Σ(SV+NV) de la misma elección, intervalo y sexo, antes de soporte",
    "relative_turnout": "Participación local menos referencia nacional propia del intervalo/sexo",
    "exact_age_reference": "La referencia de exact_age_segments usa edad exacta y sexo, no el intervalo de las seis reglas.",
    "relative_level": "Media simple de las tres diferencias por edad, no participación municipal agregada",
    "shape": "Diferencias centradas respecto a su media; dos contrastes ortonormales conservan sus dos grados de libertad",
    "adjusted_sex_gap": "Diferencia de participación relativa mujeres−hombres; requiere ambos segmentos con soporte",
    "distinct_sections": "Clave año+entidad+sección; por municipio se distingue también la clave municipal. No sumar secciones de bandas/sexos.",
    "candidate_section_union": "No disponible en estos agregados; distinct_sections es NULL en las fichas. Se informa distribución por segmento.",
    "empty_subset_zero": "Los ceros U/R/M sólo representan subconjuntos vacíos de categorías exhaustivas observadas; no se imputan tasas ausentes."
  },
  "quality_thresholds": {
    "min_LN": 100,
    "min_specified_count": 100,
    "min_source_rows": 5,
    "high_ns": 0.1,
    "near_reference": 0.02
  },
  "coordinate_order": [
    "18-34",
    "35-59",
    "60-100"
  ],
  "sex_categories": [
    {
      "code": "0",
      "label": "Hombres"
    },
    {
      "code": "1",
      "label": "Mujeres"
    }
  ],
  "age_min": 18,
  "age_max": 130,
  "main_visual_age_range": [
    18,
    100
  ],
  "district_reference_year": 2021,
  "missing_district_source_cells": {
    "is_federal_district_missing": 28477,
    "is_local_district_missing": 28477
  },
  "municipal_history_enabled": false,
  "map_geometries": null,
  "availability": [
    {
      "election_year": 2009,
      "feature": "national_statistics",
      "unit": "election",
      "available": true,
      "status": "available_with_quality_flags",
      "supported_records": 1,
      "undefined_or_pending_records": 0,
      "note": "Datos propios de la elección; consultar soporte, NS y estados de cada registro."
    },
    {
      "election_year": 2009,
      "feature": "state_statistics",
      "unit": "state",
      "available": true,
      "status": "available_with_quality_flags",
      "supported_records": 32,
      "undefined_or_pending_records": 0,
      "note": "Datos propios de la elección; consultar soporte, NS y estados de cada registro."
    },
    {
      "election_year": 2009,
      "feature": "municipality_statistics",
      "unit": "municipality",
      "available": true,
      "status": "available_with_quality_flags",
      "supported_records": 2458,
      "undefined_or_pending_records": 0,
      "note": "Datos propios de la elección; consultar soporte, NS y estados de cada registro."
    },
    {
      "election_year": 2009,
      "feature": "six_rule_profiles",
      "unit": "rule_candidate",
      "available": true,
      "status": "available_with_quality_flags",
      "supported_records": 6,
      "undefined_or_pending_records": 0,
      "note": "Datos propios de la elección; consultar soporte, NS y estados de cada registro."
    },
    {
      "election_year": 2009,
      "feature": "municipality_age_band_sex",
      "unit": "municipality_age_band_sex",
      "available": true,
      "status": "available_with_quality_flags",
      "supported_records": 14096,
      "undefined_or_pending_records": 65,
      "note": "Datos propios de la elección; consultar soporte, NS y estados de cada registro."
    },
    {
      "election_year": 2009,
      "feature": "exact_age_statistics",
      "unit": "municipality_exact_age_sex",
      "available": true,
      "status": "available_with_quality_flags",
      "supported_records": null,
      "undefined_or_pending_records": null,
      "note": "Datos propios de la elección; consultar soporte, NS y estados de cada registro."
    },
    {
      "election_year": 2009,
      "feature": "continuous_level_shape",
      "unit": "municipality_sex",
      "available": true,
      "status": "available_with_quality_flags",
      "supported_records": 4583,
      "undefined_or_pending_records": 14,
      "note": "Datos propios de la elección; consultar soporte, NS y estados de cada registro."
    },
    {
      "election_year": 2009,
      "feature": "adjusted_sex_gap",
      "unit": "municipality_age_band",
      "available": true,
      "status": "available_with_quality_flags",
      "supported_records": 7009,
      "undefined_or_pending_records": 365,
      "note": "Datos propios de la elección; consultar soporte, NS y estados de cada registro."
    },
    {
      "election_year": 2009,
      "feature": "section_context",
      "unit": "municipality_age_band_sex",
      "available": true,
      "status": "available_with_quality_flags",
      "supported_records": 18545,
      "undefined_or_pending_records": 0,
      "note": "Datos propios de la elección; consultar soporte, NS y estados de cada registro."
    },
    {
      "election_year": 2009,
      "feature": "distinct_sections",
      "unit": "section",
      "available": true,
      "status": "available_with_quality_flags",
      "supported_records": 64934,
      "undefined_or_pending_records": 0,
      "note": "Datos propios de la elección; consultar soporte, NS y estados de cada registro."
    },
    {
      "election_year": 2009,
      "feature": "sex_2_statistics",
      "unit": "national_sex",
      "available": false,
      "status": "not_recorded",
      "supported_records": null,
      "undefined_or_pending_records": null,
      "note": "El diccionario histórico no registra SEXO=2; su ausencia no significa cero personas."
    },
    {
      "election_year": 2009,
      "feature": "municipal_longitudinal_comparison",
      "unit": "municipality_history",
      "available": false,
      "status": "blocked_unvalidated_crosswalk",
      "supported_records": null,
      "undefined_or_pending_records": null,
      "note": "No existe correspondencia territorial histórica oficial validada; sólo consultas independientes por elección."
    },
    {
      "election_year": 2009,
      "feature": "learned_model_labels",
      "unit": "model_assignment",
      "available": false,
      "status": "not_generated",
      "supported_records": null,
      "undefined_or_pending_records": null,